### ISSUE TITLE
DNS 禁用（off）模式下转发流量进不了 tun —— auto_redirect 被强制关闭后，被 fw4 默认 forward 策略 RST 掉

### ISSUE THREAD

**Issue by GinatWiki** [liandu2024/Open-Box#85]
### Open-Box 版本

v0.1.167

### 固件与版本

Kwrt 25.12.5（x86/64，QEMU 虚拟机）

### 架构

x86_64

### 设备型号

unraid 虚拟机

### 发生了什么

场景：OpenWrt 不是网关，而是第二跳——上游路由器按目的地把"该走代理"的流量路由过来（mangle: src∈Need-Proxy && dst∈ProxyNet → mark-routing，路由表指向 OpenWrt），Open-Box 在这台 OpenWrt 上做代理。DNS 交给路由器上已有的自建解析器，所以 DNS 劫持设为「禁用」（正是这个模式该被用到的场合）。
现象：所有该走代理的连接被本机立刻 RST（客户端表现为 Connection refused），完全不通。
定位过程与证据
1. 路由与标记都正常：上游 mangle 计数在增长、策略路由 dst-address=0.0.0.0/0 routing-table=Openwrt gateway=10.10.10.2 生效。此时 Open-Box 内核的连接表里只有路由器自己（10.10.10.2 / 172.19.0.1），没有任何客户端 IP。
2. tcpdump -i any -e 'tcp and host <客户端> and port 443' 抓到：
br-lan In : <客户端> > 162.159.130.234.443: Flags [S]
br-lan Out: 162.159.130.234 > <客户端>: Flags [R.]     ← 源 MAC 是路由器自己的 br-lan MAC，30µs 内回
全程没有 tun0 的记录——包根本没进内核，是被 fw4 拒绝掉的。nft 里对应的规则是：
chain handle_reject {
    meta l4proto tcp reject with tcp reset comment "!fw4: Reject TCP traffic"
1. 对代码的解释（v0.1.167 实际安装版，逐条复核过）：
- engine/config.mjs 第 177 行：const autoRedirect = Boolean(profile.tun && profile.tun.autoRedirect && dnsMode !== 'off')——禁用模式下 auto_redirect 被强制关闭（注释说明：auto_redirect 自带 nft 层的 53 劫持，关不掉劫持所以只能整个关掉），于是流量只能靠 auto_route 的路由进 tun；
- system/firewall.mjs 只添加三条规则：面板 2026、DNS 7853、IPv6 泄漏 REJECT（uci show firewall 里可核对：openbox_panel / openbox_dns / openbox_v6block）。没有任何放行「转发进 tun0」的规则，而 tun0 也不属于任何 fw4 zone；
- 两者叠加：转发流量在路由层面被丢进 tun0，但在 fw4 的 forward 链上没有放行依据，撞上默认策略 REJECT（tcp-reset）。
1. 我这边把 tun0 加进 lan zone 后立刻恢复（uci add_list firewall.@zone[0].device='tun0'，lan zone 的 forward=ACCEPT），youtube / google / x.com 等全部 TLS 200 OK。但这是用户侧打补丁，防火墙重置或升级后要重做，而且不该让每个使用者自己摸出来。
期望
DNS 禁用模式下能否也让转发流量正常进 tun？可能的做法（供参考）：
- 加一条独立放行 tun0 的 forward 规则（不依赖 auto_redirect）；
- 或把 tun0 纳入某个 zone / 显式 nft 放行，由部署流程一并写入；
- 若 auto_redirect 里的 DNS 劫持部分能单独关掉（只保留流量重定向），那 off 模式也能走 nft redirect 路径，可能更干净。
如果你们认为 off 模式就是不该承载转发流量，那也可以——但请在文档里写明这个前提（"需要自行放行转发进 tun0"，或"off 模式只适用于本机 / 入站代理用法"），否则症状（connection refused）很难联想到防火墙。
由于日志有防火墙相关，openbox抓取不到，所以只能贴ai抓取的日志

### 日志 / 诊断包

```text
证据材料：off 模式转发流量进不了 tun（v0.1.167 受控复现）
  复现方式：临时撤下我们手动加的 tun0 zone 放行（即回到 Open-Box 原生状态），从 LAN 客户端发起连接并用 tcpdump -i any -e 抓包；复现后立刻恢复。
1. 客户端表现
www.youtube.com        DNS: 142.251.150.4, 142.251.151.4, 142.251.152.4, 142.251.153.4, 142.251.154.4, 142.251.155.4, 142.251.156.4, 142.251.157.4
                       TLS: FAILED: ConnectionRefusedError: [WinError 10061] 由于目标计算机积极拒绝，无法连接。
www.google.com         DNS: 142.251.150.119, 142.251.151.119, 142.251.152.119, 142.251.153.119, 142.251.154.119, 142.251.155.119, 142.251.156.119, 142.251.157.119
                       TLS: FAILED: ConnectionRefusedError: [WinError 10061] 由于目标计算机积极拒绝，无法连接。
2. tcpdump：SYN 到达路由器、被本机以「目标 IP」为源回 RST，全程无 tun0
10:39:18.262682 br-lan In  ifindex 4 d4:01:c3:02:75:2b ethertype IPv4 (0x0800), length 72: 10.10.10.4.11856 > 104.154.124.27.443: Flags [S], seq 3411230641, win 65535, options [mss 1460,nop,wscale 8,nop,nop,sackOK], length 0
10:39:18.262698 br-lan Out ifindex 4 c8:ff:bf:06:6b:73 ethertype IPv4 (0x0800), length 60: 104.154.124.27.443 > 10.10.10.4.11856: Flags [R.], seq 0, ack 3411230642, win 0, length 0
10:39:18.262942 br-lan In  ifindex 4 d4:01:c3:02:75:2b ethertype IPv4 (0x0800), length 72: 10.10.10.4.11857 > 104.154.124.27.443: Flags [S], seq 134507877, win 65535, options [mss 1460,nop,wscale 8,nop,nop,sackOK], length 0
10:39:18.262953 br-lan Out ifindex 4 c8:ff:bf:06:6b:73 ethertype IPv4 (0x0800), length 60: 104.154.124.27.443 > 10.10.10.4.11857: Flags [R.], seq 0, ack 134507878, win 0, length 0
10:39:20.306947 br-lan In  ifindex 4 d4:01:c3:02:75:2b ethertype IPv4 (0x0800), length 72: 10.10.10.4.11873 > 142.251.24.207.443: Flags [S], seq 3380516754, win 65535, options [mss 1460,nop,wscale 8,nop,nop,sackOK], length 0
10:39:20.307007 br-lan Out ifindex 4 c8:ff:bf:06:6b:73 ethertype IPv4 (0x0800), length 60: 142.251.24.207.443 > 10.10.10.4.11873: Flags [R.], seq 0, ack 3380516755, win 0, length 0
（源 MAC c8:ff:bf:06:6b:73 是路由器自己的 br-lan MAC，说明 RST 由本机生成）
3. nft：fw4 的 reject 链（把包挡回去的就是它）
13-		tcp dport 1688 counter packets 0 bytes 0 accept comment "!fw4: ubus:vlmcsd[vlmcsd] rule 0"
14-		iifname { "tun0", "br-lan" } jump input_lan comment "!fw4: Handle lan IPv4/IPv6 input traffic"
15:		jump handle_reject
16-	}
17-
18-	chain forward {
--
22-		iifname { "tun0", "br-lan" } jump forward_lan comment "!fw4: Handle lan IPv4/IPv6 forward traffic"
23-		jump upnp_forward comment "Hook into miniupnpd forwarding chain"
24:		jump handle_reject
25-	}
26-
27-	chain output {
--
37-	}
38-
39:	chain handle_reject {
40:		meta l4proto tcp reject with tcp reset comment "!fw4: Reject TCP traffic"
41-		reject comment "!fw4: Reject any other traffic"
42-	}
43-
注：上面这份 nft 快照是在加上 zone 放行之后采集的，所以能同时看到 iifname { "tun0", "br-lan" } jump forward_lan——正因为 tun0 被纳入了 lan zone，forward 链才会 jump 到 forward_lan 并放行。
修复前（即 Open-Box 原生状态）我在 nft 里检索过 tun0：当时 nft list ruleset | grep -in 'tun' 只匹配到 DNS 7853 的放行与 dnsmasq hijack 两行，没有任何 tun0 相关规则——tun0 不属于任何 zone，forward 链上也就没有任何规则命中它，于是直接落到链尾的 jump handle_reject → reject with tcp reset。（加上 zone 放行之后同样的检索是 6 处命中。）
3b. 其他相关状态
- lan zone 的策略：input=ACCEPT / output=ACCEPT / forward=ACCEPT（所以把 tun0 纳入 lan zone 即可放行转发）
- 复现前置条件确认：uci show firewall.@zone[0].device → uci: Entry not found（即 tun0 未被任何 zone 覆盖）
4. Open-Box 只添加了三条防火墙规则（无任何转发放行）
firewall.openbox_panel=rule
firewall.openbox_panel.name='Open-Box Panel (LAN)'
firewall.openbox_panel.src='lan'
firewall.openbox_panel.proto='tcp'
firewall.openbox_panel.dest_port='2026'
firewall.openbox_panel.target='ACCEPT'
firewall.openbox_dns=rule
firewall.openbox_dns.name='Open-Box DNS (LAN)'
firewall.openbox_dns.src='lan'
firewall.openbox_dns.proto='tcp udp'
firewall.openbox_dns.dest_port='7853'
firewall.openbox_dns.target='ACCEPT'
firewall.openbox_v6block=rule
firewall.openbox_v6block.name='Open-Box Block IPv6 Leak'
firewall.openbox_v6block.src='lan'
firewall.openbox_v6block.dest='wan'
firewall.openbox_v6block.family='ipv6'
firewall.openbox_v6block.target='REJECT'
5. 代码：禁用模式下 auto_redirect 被强制关闭
// IPv6「不进内核」模式(engine/dns.mjs 的 ipv6ProxyMode = bypass):tun 不给 v6 地址,auto_route 就不接管 v6,
  // 局域网的 v6 按系统路由直接从 WAN 出去;防火墙那条 v6 拦截只在 ipv6 关着时加(system/deploy.mjs)
  const v6InTun = ipv6InTun(profile)
  const tunAddress = v6InTun ? [TUN_V4, TUN_V6] : [TUN_V4]

  // auto_redirect 自带 nft 层的 DNS 劫持(局域网发往任何 53 端口的查询都改写进 tun),
  // 关不掉劫持只留 redirect;所以 DNS「禁用」模式只能把它一起关掉,流量靠 auto_route 进 tun。
  const autoRedirect = Boolean(profile.tun && profile.tun.autoRedirect && dnsMode !== 'off')
  // 本机接口网段只在「auto_redirect + 劫持模式」下才从排除表里挖出来:挖它是为了 nft 里 DNS 改写
  // 规则能碰到发给路由器的查询(劫持模式靠这个把局域网 DNS 拦进内核),而 nft 另有 local_address_set
  // 的 return 保证这些网段不进 tun。dnsmasq 转发模式不需要:局域网的查询本来就该直接到 dnsmasq,
  // 挖掉只会让每个查询先被改写进 tun、再由内核送回本机 dnsmasq 绕一圈(审核 A2);不挖,发给
  // 路由器的查询在入口就 return,根本不进内核。
  // 没有 auto_redirect 时只剩路由规则(strict_route),排除表就是唯一的"本机网段不进 tun"
  // 依据——挖掉之后路由器回给局域网的每个包都被路由进 tun 吞掉,LuCI / 面板 / DNS 全部失联,
  // 重启后内核自启立刻复现(v0.1.65–v0.1.70 的「禁用」模式,正式路由器和开发路由器都实测)。
  const holes = autoRedirect && dnsMode === 'hijack' ? [...localSubnets, TUN_V4_NET, TUN_V6_NET] : [TUN_V4_NET, TUN_V6_NET]
6. 生成的 sing-box 配置：tun 入站没有 auto_redirect
173:      "type": "tun",
174-      "tag": "tun-in",
175-      "address": [
176-        "172.19.0.1/30"
177-      ],
178-      "auto_route": true,
179-      "strict_route": true,
180-      "stack": "mixed",
181-      "route_exclude_address": [
182-        "10.0.0.0/8",
183-        "100.64.0.0/10",
184-        "169.254.0.0/16",
185-        "172.16.0.0/15",
186-        "172.18.0.0/16",
187-        "172.19.0.4/30",
7. 对照：加上 tun0 的 zone 放行后立刻恢复
www.youtube.com  TLS: OK peer=142.251.155.4 HTTP/1.1 200 OK
www.google.com   TLS: OK peer=142.251.150.119 HTTP/1.1 200 OK
8. 环境
=== 采集时间 ===
Sat Sep 12 10:39:16 CST 2026
=== 版本 ===
{
  "version": "v0.1.167",
  "singboxVersion": "1.14.0-openbox-tcp1",
  "nodeVersion": "24.18.0",
  "arch": "x64",
  "builtAt": "2026-09-11T18:00:25Z"
}
=== 内核版本 ===
sing-box version 1.14.0-openbox-tcp1

Environment: go1.26.8 linux/amd64
=== tun0 ===
tun0             UNKNOWN        172.19.0.1/30 fe80::6a7:70b3:603b:3a95/64 
=== ip rule ===
0:	from all lookup local
9000:	from all to 172.19.0.0/30 lookup 2022
9001:	from all lookup 2022 suppress_prefixlength 0
9002:	not from all dport 53 lookup main suppress_prefixlength 0
9002:	from all iif tun0 goto 9010
9003:	not from all iif lo lookup 2022
9003:	from 0.0.0.0 iif lo lookup 2022
9003:	from 172.19.0.0/30 iif lo lookup 2022
9010:	from all nop
32766:	from all lookup main
32767:	from all lookup default
```

### 环境情况

- [x] 同时装了 OpenClash / PassWall / Nikki / ShellCrash 等其他代理插件
- [ ] 开启了 IPv6
- [ ] 双 WAN / mwan3
- [ ] 路由器上还跑着 Docker

### 确认

- [x] 我已经升级到最新版本再复现过

**Comment by liandu2024** [comment]
v0.1.176 已修复。关闭 DNS 接管后，部署仍会生成仅允许 LAN 到 `tun0` 的 fw4 转发规则；不会把 `tun0` 整体加入 LAN zone，也不会开放 WAN。已在开发机检查 fw4/nft 规则，并用隔离的 TCP/UDP 场景验证规则启用前后行为。

发布地址：https://github.com/liandu2024/Open-Box/releases/tag/v0.1.176

**Comment by GinatWiki** [comment]
感谢处理，v0.1.176 我已按「只看发行包、不看 main 分支」的方式复核完整，并在真机上验证了规则确实生效，确认修复，本 issue 关闭。
